{"admitted":{"file_count":172,"graph_fields":["aggregate_counts","aggregate_source_quality_label_counts","aggregate_relationship_kind_counts"],"source_fields":["library_id","identity.title","identity.creators","identity.year","identity.type","identity.language","normalized_rights_category"]},"checks":{"credential_and_local_path_scan":"pass","explicit_inputs_verified":"pass","field_allowlist_applied":"pass","forbidden_candidate_paths":"pass","no_semantic_model_call":"pass","private_evidence_text_scan":"pass","private_inputs_unchanged":"pass","source_assets_verified":"pass"},"decision":"candidate_requires_clean_history_audit","limitations":["Aggregate counts do not establish scientific coverage or correctness.","The full evidence-bearing graph and source assets remain private.","Local verification does not authorize external publication."],"private_inputs":{"graph_manifest_sha256":"ce95d23505a458318965076cd1e22568bf67314d7f33a9451d3373b7cda98e87","graph_sha256":"ae1bc089023459e8c315e1392b64339ad8c44a212116a368f77b89c8cdcb5627","private_report_sha256":"ebf2f9decacfae896191cfff8dbd38cb7e8cd388feaaed9e49cd046f043cede8","private_repository_commit":"712e5e53f122232ff0fba6bf33195f607dec5c54","projection_repository_commit":"df7b84823f4048570ee0387422c70e7042fb6735","source_integrity_sha256":"092489dd5bd7c2910e8025c61c2d687831b5865a806a970ed58a16a43a832d5b"},"public_scope":{"data":"aggregate_results_plus_synthetic_demonstration","dataset_license":"none_granted","external_actions_authorized":false,"license":"Apache-2.0","third_party_rights":"separate"},"release_id":"public-experimental-repository-baseline-v1","schema_version":"1.0","withheld":{"evidence_bearing_graph":true,"graph_fields":["nodes","endpoints","source_pairs","statements","evidence_spans","rationales","scopes","qualifications"],"private_project_history":true,"source_assets":54}}
